{
  "$schema": "../schemas/reviewed-device-facts.schema.json",
  "schema": "hyperflux-reviewed-device-facts-v1",
  "reviewed_on": "2026-07-21",
  "sources": [
    {
      "id": "github-openrazer-basilisk-bluetooth-2407",
      "kind": "upstream-issue",
      "publisher": "OpenRazer",
      "title": "Basilisk V3 Pro 35K Bluetooth support report",
      "url": "https://github.com/openrazer/openrazer/issues/2407",
      "retrieved_on": "2026-07-21",
      "revision": "Issue 2407, reviewed 2026-07-21",
      "authority": ["transport-identity", "transport-limitation"]
    },
    {
      "id": "github-openrazer-blackwidow-lowprofile-2546",
      "kind": "upstream-issue",
      "publisher": "OpenRazer",
      "title": "BlackWidow V4 Low-profile HyperSpeed support report",
      "url": "https://github.com/openrazer/openrazer/issues/2546",
      "retrieved_on": "2026-07-21",
      "revision": "Issue 2546, reviewed 2026-07-21",
      "authority": ["transport-identity"]
    },
    {
      "id": "github-openrazer-blackwidow-lowprofile-tkl-2593",
      "kind": "upstream-issue",
      "publisher": "OpenRazer",
      "title": "BlackWidow V4 Low-profile Tenkeyless HyperSpeed support report",
      "url": "https://github.com/openrazer/openrazer/issues/2593",
      "retrieved_on": "2026-07-21",
      "revision": "Issue 2593, reviewed 2026-07-21",
      "authority": ["transport-identity"]
    },
    {
      "id": "razer-bluetooth-compatibility",
      "kind": "official-compatibility",
      "publisher": "Razer",
      "title": "Razer Synapse supported devices via Bluetooth connection",
      "url": "https://mysupport.razer.com/app/answers/detail/a_id/14589/kw/key%20switches",
      "retrieved_on": "2026-07-21",
      "revision": "Answer 14589, updated 2026-05-11",
      "authority": ["product-capability", "transport-limitation"]
    },
    {
      "id": "razer-manual-basilisk-v3-pro",
      "kind": "official-manual",
      "publisher": "Razer",
      "title": "Razer Basilisk V3 Pro master guide",
      "url": "https://dl.razerzone.com/master-guides/RazerSynapse3/BASILISKV3PRO-00000170-en.pdf",
      "retrieved_on": "2026-07-21",
      "revision": "BASILISKV3PRO-00000170-en",
      "authority": ["product-capability", "product-procedure"]
    },
    {
      "id": "razer-manual-basilisk-v3-pro-35k",
      "kind": "official-manual",
      "publisher": "Razer",
      "title": "Razer Basilisk V3 Pro 35K master guide",
      "url": "https://dl.razerzone.com/master-guides/RazerSynapse3/BASILISKV3PRO35K-00000204-en.pdf",
      "retrieved_on": "2026-07-21",
      "revision": "BASILISKV3PRO35K-00000204-en",
      "authority": ["product-capability", "product-procedure"]
    },
    {
      "id": "razer-manual-blackwidow-v3-pro",
      "kind": "official-manual",
      "publisher": "Razer",
      "title": "Razer BlackWidow V3 Pro master guide",
      "url": "https://dl.razerzone.com/master-guides/RazerSynapse3/BLACKWIDOWV3PRO-00000602-en.pdf",
      "retrieved_on": "2026-07-21",
      "revision": "BLACKWIDOWV3PRO-00000602-en",
      "authority": ["product-capability", "product-procedure"]
    },
    {
      "id": "razer-manual-blackwidow-v4-lowprofile",
      "kind": "official-manual",
      "publisher": "Razer",
      "title": "Razer BlackWidow V4 Low-profile HyperSpeed master guide",
      "url": "https://dl.razerzone.com/master-guides/RazerSynapse4/BLACKWIDOWV4LOWPROFILEHYPERSPEED-00000716-en.pdf",
      "retrieved_on": "2026-07-21",
      "revision": "BLACKWIDOWV4LOWPROFILEHYPERSPEED-00000716-en",
      "authority": ["product-capability", "product-procedure"]
    },
    {
      "id": "razer-manual-blackwidow-v4-lowprofile-tkl",
      "kind": "official-manual",
      "publisher": "Razer",
      "title": "Razer BlackWidow V4 Low-profile Tenkeyless HyperSpeed master guide",
      "url": "https://dl.razerzone.com/master-guides/RazerSynapse4/BLACKWIDOWV4LOWPROFILETENKEYLESSHYPERSPEED-00000724-en.pdf",
      "retrieved_on": "2026-07-21",
      "revision": "BLACKWIDOWV4LOWPROFILETENKEYLESSHYPERSPEED-00000724-en",
      "authority": ["product-capability", "product-procedure"]
    },
    {
      "id": "razer-manual-blackwidow-v4-mini",
      "kind": "official-manual",
      "publisher": "Razer",
      "title": "Razer BlackWidow V4 Mini HyperSpeed master guide",
      "url": "https://dl.razerzone.com/master-guides/RazerSynapse3/BLACKWIDOWV4MINIHYPERSPEED-00000697-en.pdf",
      "retrieved_on": "2026-07-21",
      "revision": "BLACKWIDOWV4MINIHYPERSPEED-00000697-en",
      "authority": ["product-capability", "product-procedure"]
    },
    {
      "id": "razer-manual-blackwidow-v4-tkl",
      "kind": "official-manual",
      "publisher": "Razer",
      "title": "Razer BlackWidow V4 Tenkeyless HyperSpeed master guide",
      "url": "https://dl.razerzone.com/master-guides/RazerSynapse4/BLACKWIDOWV4TENKEYLESSHYPERSPEED-00000727-en.pdf",
      "retrieved_on": "2026-07-21",
      "revision": "BLACKWIDOWV4TENKEYLESSHYPERSPEED-00000727-en",
      "authority": ["product-capability", "product-procedure"]
    },
    {
      "id": "razer-manual-cobra-hyperspeed",
      "kind": "official-manual",
      "publisher": "Razer",
      "title": "Razer Cobra HyperSpeed master guide",
      "url": "https://dl.razerzone.com/master-guides/RazerSynapse4/COBRAHYPERSPEED-00000218-en.pdf",
      "retrieved_on": "2026-07-21",
      "revision": "COBRAHYPERSPEED-00000218-en",
      "authority": ["product-capability", "product-procedure"]
    },
    {
      "id": "razer-manual-cobra-pro",
      "kind": "official-manual",
      "publisher": "Razer",
      "title": "Razer Cobra Pro master guide",
      "url": "https://dl.razerzone.com/master-guides/RazerSynapse3/COBRAPRO-00000175-en.pdf",
      "retrieved_on": "2026-07-21",
      "revision": "COBRAPRO-00000175-en",
      "authority": ["product-capability", "product-procedure"]
    },
    {
      "id": "razer-manual-deathstalker-v2-pro",
      "kind": "official-manual",
      "publisher": "Razer",
      "title": "Razer DeathStalker V2 Pro master guide",
      "url": "https://dl.razerzone.com/master-guides/RazerSynapse3/DEATHSTALKERV2PRO-00000658-en.pdf",
      "retrieved_on": "2026-07-21",
      "revision": "DEATHSTALKERV2PRO-00000658-en",
      "authority": ["product-capability", "product-procedure"]
    },
    {
      "id": "razer-manual-deathstalker-v2-pro-tkl",
      "kind": "official-manual",
      "publisher": "Razer",
      "title": "Razer DeathStalker V2 Pro Tenkeyless master guide",
      "url": "https://dl.razerzone.com/master-guides/RazerSynapse3/DEATHSTALKERV2PROTKL-00000662-en.pdf",
      "retrieved_on": "2026-07-21",
      "revision": "DEATHSTALKERV2PROTKL-00000662-en",
      "authority": ["product-capability", "product-procedure"]
    },
    {
      "id": "razer-manual-naga-v2-pro",
      "kind": "official-manual",
      "publisher": "Razer",
      "title": "Razer Naga V2 Pro master guide",
      "url": "https://dl.razerzone.com/master-guides/RazerSynapse3/NAGAV2PRO-00000167-en.pdf",
      "retrieved_on": "2026-07-21",
      "revision": "NAGAV2PRO-00000167-en",
      "authority": ["product-capability", "product-procedure"]
    },
    {
      "id": "razer-product-basilisk-v3-pro-35k",
      "kind": "official-product",
      "publisher": "Razer",
      "title": "Razer Basilisk V3 Pro 35K product page",
      "url": "https://www.razer.com/gaming-mice/razer-basilisk-v3-pro-35k",
      "retrieved_on": "2026-07-21",
      "revision": "Product page, reviewed 2026-07-21",
      "authority": ["product-capability"]
    },
    {
      "id": "razer-product-blackwidow-v4-lowprofile",
      "kind": "official-product",
      "publisher": "Razer",
      "title": "Razer BlackWidow V4 Low-profile HyperSpeed product page",
      "url": "https://www.razer.com/gaming-keyboards/razer-blackwidow-v4-low-profile-hyperspeed",
      "retrieved_on": "2026-07-21",
      "revision": "Product page, reviewed 2026-07-21",
      "authority": ["product-capability", "product-procedure"]
    },
    {
      "id": "razer-product-blackwidow-v4-lowprofile-tkl",
      "kind": "official-product",
      "publisher": "Razer",
      "title": "Razer BlackWidow V4 Low-profile Tenkeyless HyperSpeed product page",
      "url": "https://www.razer.com/gaming-keyboards/razer-blackwidow-v4-low-profile-tenkeyless-hyperspeed",
      "retrieved_on": "2026-07-21",
      "revision": "Product page, reviewed 2026-07-21",
      "authority": ["product-capability", "product-procedure"]
    },
    {
      "id": "razer-product-blackwidow-v4-mini",
      "kind": "official-product",
      "publisher": "Razer",
      "title": "Razer BlackWidow V4 Mini HyperSpeed product page",
      "url": "https://www.razer.com/ca-en/gaming-keyboards/razer-blackwidow-v4-mini-hyperspeed",
      "retrieved_on": "2026-07-21",
      "revision": "Canadian product page, reviewed 2026-07-21",
      "authority": ["product-capability", "product-procedure"]
    },
    {
      "id": "razer-product-blackwidow-v4-tkl",
      "kind": "official-product",
      "publisher": "Razer",
      "title": "Razer BlackWidow V4 Tenkeyless HyperSpeed product page",
      "url": "https://www.razer.com/gaming-keyboards/razer-blackwidow-v4-tenkeyless-hyperspeed",
      "retrieved_on": "2026-07-21",
      "revision": "Product page, reviewed 2026-07-21",
      "authority": ["product-capability", "product-procedure"]
    },
    {
      "id": "razer-product-hyperflux-v2",
      "kind": "official-compatibility",
      "publisher": "Razer",
      "title": "Razer HyperFlux V2 Wireless Charging System product page",
      "url": "https://www.razer.com/gaming-mouse-mats/razer-hyperflux-v2-wireless-charging-system",
      "retrieved_on": "2026-07-21",
      "revision": "Product page compatibility lists, reviewed 2026-07-21",
      "authority": ["product-capability", "transport-limitation"]
    },
    {
      "id": "razer-product-naga-v2-pro",
      "kind": "official-product",
      "publisher": "Razer",